{
  "cell_id": "bnb-nf4/mmlu/international_law",
  "config": {
    "apply_chat_template": true,
    "batch_size": 4,
    "fewshot_as_multiturn": true,
    "lm_eval_version": "0.4.3",
    "max_length": null,
    "model_revision": "a09a35458c702b33eeacc393d103063234e8bc28",
    "num_fewshot": 5,
    "seeds": {
      "fewshot": 1234,
      "numpy": 1234,
      "random": 0,
      "torch": 1234
    }
  },
  "extra_metrics": {
    "acc_stderr,none": 0.03321244842547128
  },
  "meta": {
    "item_correct": [
      1,
      1,
      1,
      1,
      1,
      1,
      1,
      1,
      1,
      1,
      1,
      1,
      1,
      1,
      1,
      0,
      1,
      1,
      1,
      0,
      1,
      1,
      1,
      1,
      1,
      1,
      1,
      0,
      0,
      1,
      1,
      0,
      1,
      1,
      1,
      1,
      1,
      0,
      1,
      1,
      1,
      1,
      1,
      1,
      1,
      0,
      1,
      1,
      1,
      1,
      1,
      1,
      1,
      1,
      1,
      1,
      1,
      0,
      1,
      1,
      1,
      1,
      1,
      1,
      1,
      1,
      1,
      1,
      1,
      1,
      1,
      0,
      0,
      1,
      0,
      1,
      0,
      1,
      0,
      0,
      0,
      1,
      1,
      1,
      1,
      0,
      0,
      1,
      1,
      1,
      1,
      1,
      1,
      1,
      1,
      1,
      1,
      1,
      1,
      1,
      1,
      1,
      1,
      0,
      1,
      1,
      1,
      1,
      1,
      1,
      1,
      1,
      1,
      0,
      1,
      1,
      1,
      1,
      1,
      1,
      1
    ],
    "item_ids": [
      0,
      1,
      2,
      3,
      4,
      5,
      6,
      7,
      8,
      9,
      10,
      11,
      12,
      13,
      14,
      15,
      16,
      17,
      18,
      19,
      20,
      21,
      22,
      23,
      24,
      25,
      26,
      27,
      28,
      29,
      30,
      31,
      32,
      33,
      34,
      35,
      36,
      37,
      38,
      39,
      40,
      41,
      42,
      43,
      44,
      45,
      46,
      47,
      48,
      49,
      50,
      51,
      52,
      53,
      54,
      55,
      56,
      57,
      58,
      59,
      60,
      61,
      62,
      63,
      64,
      65,
      66,
      67,
      68,
      69,
      70,
      71,
      72,
      73,
      74,
      75,
      76,
      77,
      78,
      79,
      80,
      81,
      82,
      83,
      84,
      85,
      86,
      87,
      88,
      89,
      90,
      91,
      92,
      93,
      94,
      95,
      96,
      97,
      98,
      99,
      100,
      101,
      102,
      103,
      104,
      105,
      106,
      107,
      108,
      109,
      110,
      111,
      112,
      113,
      114,
      115,
      116,
      117,
      118,
      119,
      120
    ],
    "lm_eval_version": "0.4.3",
    "model_revision": "a09a35458c702b33eeacc393d103063234e8bc28",
    "n_correct": 102,
    "quant_method": "bnb-nf4",
    "source": "load-time"
  },
  "metric_stderr": 0.03321244842547128,
  "metric_value": 0.8429752066115702,
  "n_samples": 121,
  "primary_metric": "acc",
  "schema_version": 1,
  "subject": "international_law",
  "task": "mmlu",
  "task_lm_eval": "mmlu_international_law",
  "variant": "bnb-nf4"
}